{
  "$schema": "../schema/etalon.schema.json",
  "id": "etalon",
  "title": "Set etalon adnotat manual pentru extractoarele deterministe",
  "publisher": "Cristian Nichifor",
  "period": "2026",
  "provenance": {
    "source": "redactare-proprie",
    "locator": "scripts/etalon.py; 36 de cazuri scrise în registrul redactării legislative românești",
    "confidence": "assumed",
    "note": "Niciun caz nu vine de pe legislatie.just.ro. Sunt scrise în stilul actelor normative românești, dar de aceeași mână care a scris și tiparele — măsoară dacă extractoarele fac ce au fost proiectate să facă, nu cât din corpusul real acoperă. «assumed» e eticheta corectă până când setul e înlocuit cu fraze extrase din acte reale."
  },
  "limitations": [
    {
      "id": "etalon-nu-e-esantion",
      "text": "Cazurile sunt scrise, nu eșantionate. Cifra de precizie și acoperire pe care o raportează scripts/etalon.py nu este acoperirea corpusului real, care va fi mai mică.",
      "severity": "material",
      "affects": [
        "precizie",
        "acoperire",
        "f1"
      ]
    },
    {
      "id": "esecuri-pastrate",
      "text": "Cazurile marcate «cunoscut_ratat» pică intenționat și rămân în set. Scoase, cifra ar crește și ar înceta să măsoare ceva.",
      "severity": "note",
      "affects": [
        "acoperire"
      ]
    }
  ],
  "cazuri": [
    {
      "id": "ref-01",
      "grup": "referinte",
      "text": "Se aplică prevederile Legii nr. 98/2016 privind achizițiile publice.",
      "asteptat": {
        "acte": [
          "lege-98-2016"
        ]
      },
      "nota": "Genitiv — forma cea mai frecventă de citare."
    },
    {
      "id": "ref-02",
      "grup": "referinte",
      "text": "Potrivit art. 5 din Ordonanța de urgență a Guvernului nr. 57/2019 privind Codul administrativ.",
      "asteptat": {
        "acte": [
          "oug-57-2019",
          "cod-administrativ"
        ],
        "referinte": [
          [
            "oug-57-2019",
            "art5"
          ]
        ]
      },
      "nota": "OUG trebuie încercată înaintea OG, altfel iese o simplă ordonanță."
    },
    {
      "id": "ref-03",
      "grup": "referinte",
      "text": "Ordinul ministrului finanțelor publice nr. 1.802/2014 se aplică în continuare.",
      "asteptat": {
        "acte": [
          "ordin-1802-2014"
        ]
      },
      "nota": "Punctul e separator de mii. Citit ca «nr. 1» ar contopi două ordine diferite."
    },
    {
      "id": "ref-04",
      "grup": "referinte",
      "text": "În aplicarea Hotărârii Guvernului nr. 395/2016, cu modificările și completările ulterioare.",
      "asteptat": {
        "acte": [
          "hg-395-2016"
        ]
      },
      "nota": "Genitivul lui «Hotărârea» plus calificatorul de urmă."
    },
    {
      "id": "ref-05",
      "grup": "referinte",
      "text": "Prevederile Ordonanței Guvernului nr. 26/2000 cu privire la asociații și fundații.",
      "asteptat": {
        "acte": [
          "og-26-2000"
        ]
      },
      "nota": "OG simplă, la genitiv."
    },
    {
      "id": "ref-06",
      "grup": "referinte",
      "text": "Se modifică art. 12^1 alin. (2) lit. a) din Legea nr. 50/1991, republicată.",
      "asteptat": {
        "acte": [
          "lege-50-1991"
        ],
        "referinte": [
          [
            "lege-50-1991",
            "art12^1.alin2.lita"
          ]
        ]
      },
      "nota": "Numerotarea cu exponent și lanțul complet de localizare."
    },
    {
      "id": "ref-07",
      "grup": "referinte",
      "text": "Alineatul (3) al articolului 8 rămâne neschimbat.",
      "asteptat": {
        "acte": [],
        "referinte": [
          [
            null,
            "art8.alin3"
          ]
        ]
      },
      "nota": "Genitivul lui «articolul». Prima versiune a modulului pierdea aici articolul întreg."
    },
    {
      "id": "ref-08",
      "grup": "referinte",
      "text": "Se respectă termenele din Codul de procedură fiscală și din Codul muncii.",
      "asteptat": {
        "acte": [
          "cod-procedura-fiscala",
          "cod-muncii"
        ]
      },
      "nota": "Codurile se citează pe nume, nu pe număr."
    },
    {
      "id": "ref-09",
      "grup": "referinte",
      "text": "Potrivit art. 1 alin. (5) din Constituția României, republicată.",
      "asteptat": {
        "acte": [
          "constitutie"
        ],
        "referinte": [
          [
            "constitutie",
            "art1.alin5"
          ]
        ]
      },
      "nota": "Constituția se citează pe nume și poartă localizare ca orice alt act."
    },
    {
      "id": "ref-10",
      "grup": "referinte",
      "text": "La articolele 7 și 8 se fac următoarele completări.",
      "asteptat": {
        "referinte": [
          [
            null,
            "art7"
          ],
          [
            null,
            "art8"
          ]
        ]
      },
      "nota": "cunoscut-ratat: enumerările de articole nu sunt desfăcute. Se citește doar art. 7.",
      "cunoscut_ratat": true
    },
    {
      "id": "am-01",
      "grup": "amendamente",
      "act_gazda": "lege-200-2026",
      "text": "Legea nr. 98/2016 privind achizițiile publice, cu modificările și completările ulterioare, se modifică și se completează după cum urmează:\n1. La articolul 7, alineatul (2) se modifică și va avea următorul cuprins:\n2. Articolul 15 se abrogă.",
      "asteptat": {
        "amendamente": [
          [
            "modifica",
            "lege-98-2016",
            "art7.alin2"
          ],
          [
            "abroga",
            "lege-98-2016",
            "art15"
          ]
        ]
      },
      "nota": "Chapeau plus puncte numerotate: forma standard. Fără moștenirea țintei, graful iese gol."
    },
    {
      "id": "am-02",
      "grup": "amendamente",
      "act_gazda": "lege-200-2026",
      "text": "La data intrării în vigoare a prezentei legi se abrogă Legea nr. 50/1991 privind autorizarea executării lucrărilor de construcții.",
      "asteptat": {
        "amendamente": [
          [
            "abroga",
            "lege-50-1991",
            ""
          ]
        ]
      },
      "nota": "Ținta e după verb și e un act întreg — direcția opusă față de am-03."
    },
    {
      "id": "am-03",
      "grup": "amendamente",
      "act_gazda": "lege-200-2026",
      "text": "Articolul 15 se abrogă.",
      "asteptat": {
        "amendamente": [
          [
            "abroga",
            "lege-200-2026",
            "art15"
          ]
        ]
      },
      "nota": "Fără chapeau, ținta e actul-gazdă însuși."
    },
    {
      "id": "am-04",
      "grup": "amendamente",
      "act_gazda": "lege-200-2026",
      "text": "Legea nr. 98/2016 se modifică după cum urmează:\n1. După articolul 12 se introduce un nou articol, art. 12^1, cu următorul cuprins:",
      "asteptat": {
        "amendamente": [
          [
            "introduce",
            "lege-98-2016",
            "art12"
          ]
        ],
        "articole_noi": [
          "12^1"
        ]
      },
      "nota": "Ancora e art. 12, articolul nou e 12^1. Confundate, linterul raportează despre articolul greșit."
    },
    {
      "id": "am-05",
      "grup": "amendamente",
      "act_gazda": "lege-200-2026",
      "text": "Legea nr. 98/2016 se modifică după cum urmează:\n1. Alineatul (3) al articolului 8 se abrogă.",
      "asteptat": {
        "amendamente": [
          [
            "abroga",
            "lege-98-2016",
            "art8.alin3"
          ]
        ]
      },
      "nota": "Genitiv inversat. Citit ca două localizări, ar raporta articolul 8 abrogat în întregime."
    },
    {
      "id": "am-06",
      "grup": "amendamente",
      "act_gazda": "lege-200-2026",
      "text": "Prin derogare de la prevederile art. 5 din Legea nr. 98/2016, contractele se atribuie direct.",
      "asteptat": {
        "amendamente": [
          [
            "deroga",
            "lege-98-2016",
            "art5"
          ]
        ]
      },
      "nota": "Derogarea nu modifică textul, dar schimbă ce se aplică — muchie proprie."
    },
    {
      "id": "am-07",
      "grup": "amendamente",
      "act_gazda": "lege-200-2026",
      "text": "Termenul prevăzut la art. 3 se prorogă până la data de 31 decembrie 2027.",
      "asteptat": {
        "amendamente": [
          [
            "proroga",
            "lege-200-2026",
            "art3"
          ]
        ]
      },
      "nota": "Prorogarea e cea mai frecventă modificare tăcută a unui termen."
    },
    {
      "id": "am-08",
      "grup": "amendamente",
      "act_gazda": "lege-200-2026",
      "text": "Aplicarea prevederilor art. 8 se suspendă până la 31 decembrie 2026.",
      "asteptat": {
        "amendamente": [
          [
            "suspenda",
            "lege-200-2026",
            "art8"
          ]
        ]
      },
      "nota": "Suspendarea lasă textul în vigoare dar îl scoate din aplicare — muchie proprie, nu o modificare."
    },
    {
      "id": "am-09",
      "grup": "amendamente",
      "act_gazda": "lege-200-2026",
      "text": "Prezenta lege nu se abrogă prin intrarea în vigoare a altor acte normative.",
      "asteptat": {
        "amendamente": []
      },
      "nota": "Negația. «nu se abrogă» citit ca abrogare inversează cel mai consecvent nod din graf."
    },
    {
      "id": "am-10",
      "grup": "amendamente",
      "act_gazda": "lege-200-2026",
      "text": "Hotărârea Guvernului nr. 395/2016 se modifică după cum urmează:\n1. La articolul 2, litera b) se modifică.",
      "asteptat": {
        "amendamente": [
          [
            "modifica",
            "hg-395-2016",
            "art2.litb"
          ]
        ]
      },
      "nota": "Chapeau pe o hotărâre, nu pe o lege."
    },
    {
      "id": "am-11",
      "grup": "amendamente",
      "act_gazda": "lege-200-2026",